{
  "commitSha": "a1b2c3d4e5f60718293a4b5c6d7e8f9012345678",
  "state": "available",
  "requests": [
    {
      "id": "01K6B3P2A9QRSTVWXYZ0123456",
      "reviewId": "01K6B3A1B2C3D4E5F6G7H8J9KM",
      "repositoryId": "01K6B2Z0R3P0S1T2V3W4X5Y6Z7",
      "status": "in_progress",
      "awaiting": "agent",
      "resolution": null,
      "closed": false,
      "anchor": {
        "kind": "symbol",
        "path": "src/Billing/InvoiceTotals.php",
        "range": {
          "startLine": 38,
          "endLine": 49
        },
        "symbol": {
          "language": "php",
          "kind": "method",
          "fqn": "App\\Billing\\InvoiceTotals::total()"
        }
      },
      "summary": "Use `Money` instead of `float` for totals.",
      "author": {
        "kind": "user",
        "userId": "01K6AZZ9Y8X7W6V5T4S3R2Q1P0",
        "agentName": null,
        "name": "janklan",
        "avatarUrl": "https://avatars.githubusercontent.com/u/1?v=4"
      },
      "claimedBy": {
        "kind": "agent",
        "userId": "01K6AZZ9Y8X7W6V5T4S3R2Q1P0",
        "agentName": "claude-code laptop",
        "name": "claude-code laptop",
        "avatarUrl": null
      },
      "claimedAt": "2026-09-29T07:40:00Z",
      "commentCount": 0,
      "commitCount": 1,
      "pendingCommitCount": 0,
      "outdated": false,
      "createdAt": "2026-09-29T07:20:00Z",
      "updatedAt": "2026-09-29T07:45:00Z",
      "lastEventSeq": 1842,
      "carriedFrom": null,
      "requireApproval": false,
      "proposal": null
    },
    {
      "id": "01K6B3P2A9QRSTVWXYZ0123457",
      "reviewId": "01K6B3A1B2C3D4E5F6G7H8J9KM",
      "repositoryId": "01K6B2Z0R3P0S1T2V3W4X5Y6Z7",
      "status": "in_progress",
      "awaiting": "agent",
      "resolution": null,
      "closed": false,
      "anchor": {
        "kind": "range",
        "path": "src/Billing/InvoiceTotals.php",
        "range": {
          "startLine": 52,
          "endLine": 58
        },
        "symbol": null
      },
      "summary": "Extract the tax rounding into `TaxRounding`.",
      "author": {
        "kind": "user",
        "userId": "01K6AZZ9Y8X7W6V5T4S3R2Q1P0",
        "agentName": null,
        "name": "janklan",
        "avatarUrl": "https://avatars.githubusercontent.com/u/1?v=4"
      },
      "claimedBy": {
        "kind": "agent",
        "userId": "01K6AZZ9Y8X7W6V5T4S3R2Q1P0",
        "agentName": "claude-code laptop",
        "name": "claude-code laptop",
        "avatarUrl": null
      },
      "claimedAt": "2026-09-29T07:41:00Z",
      "commentCount": 1,
      "commitCount": 1,
      "pendingCommitCount": 0,
      "outdated": false,
      "createdAt": "2026-09-29T07:10:00Z",
      "updatedAt": "2026-09-29T07:45:00Z",
      "lastEventSeq": 1842,
      "carriedFrom": null,
      "requireApproval": false,
      "proposal": null
    }
  ],
  "events": [
    {
      "seq": 1842,
      "eventId": "01K6C2EVT00000000000001842",
      "type": "commit.linked",
      "reviewId": "01K6B3A1B2C3D4E5F6G7H8J9KM",
      "requestId": null,
      "requestIds": ["01K6B3P2A9QRSTVWXYZ0123456", "01K6B3P2A9QRSTVWXYZ0123457"],
      "actor": {
        "kind": "agent",
        "userId": "01K6AZZ9Y8X7W6V5T4S3R2Q1P0",
        "agentName": "claude-code laptop",
        "name": "claude-code laptop",
        "avatarUrl": null
      },
      "occurredAt": "2026-09-29T07:45:00Z",
      "body": "One refactoring covers both.",
      "diff": null,
      "commentId": null,
      "question": false,
      "batchId": null,
      "commitSha": "a1b2c3d4e5f60718293a4b5c6d7e8f9012345678",
      "statusAfter": null
    }
  ]
}
