{
  "commitSha": "e5f6a7b8c9d0e1f2a3b4c5d6e7f8091a2b3c4d5e",
  "state": "pending",
  "requests": [
    {
      "id": "01K6B3P2A9QRSTVWXYZ0123457",
      "reviewId": "01K6B3A1B2C3D4E5F6G7H8J9KM",
      "repositoryId": "01K6B2Z0R3P0S1T2V3W4X5Y6Z7",
      "status": "in_progress",
      "awaiting": "agent",
      "resolution": null,
      "closed": false,
      "anchor": {
        "kind": "range",
        "path": "src/Billing/InvoiceTotals.php",
        "range": {
          "startLine": 52,
          "endLine": 58
        },
        "symbol": null
      },
      "summary": "Extract the tax rounding into `TaxRounding`.",
      "author": {
        "kind": "user",
        "userId": "01K6AZZ9Y8X7W6V5T4S3R2Q1P0",
        "agentName": null,
        "name": "janklan",
        "avatarUrl": "https://avatars.githubusercontent.com/u/1?v=4"
      },
      "claimedBy": {
        "kind": "agent",
        "userId": "01K6AZZ9Y8X7W6V5T4S3R2Q1P0",
        "agentName": "claude-code laptop",
        "name": "claude-code laptop",
        "avatarUrl": null
      },
      "claimedAt": "2026-09-29T07:41:00Z",
      "commentCount": 2,
      "commitCount": 2,
      "pendingCommitCount": 1,
      "outdated": false,
      "createdAt": "2026-09-29T07:10:00Z",
      "updatedAt": "2026-09-29T07:58:00Z",
      "lastEventSeq": 1851,
      "carriedFrom": null,
      "requireApproval": false,
      "proposal": null
    }
  ],
  "events": [
    {
      "seq": 1851,
      "eventId": "01K6C2EVT00000000000001851",
      "type": "commit.linked",
      "reviewId": "01K6B3A1B2C3D4E5F6G7H8J9KM",
      "requestId": null,
      "requestIds": ["01K6B3P2A9QRSTVWXYZ0123457"],
      "actor": {
        "kind": "agent",
        "userId": "01K6AZZ9Y8X7W6V5T4S3R2Q1P0",
        "agentName": "claude-code laptop",
        "name": "claude-code laptop",
        "avatarUrl": null
      },
      "occurredAt": "2026-09-29T07:58:00Z",
      "body": null,
      "diff": null,
      "commentId": null,
      "question": false,
      "batchId": null,
      "commitSha": "e5f6a7b8c9d0e1f2a3b4c5d6e7f8091a2b3c4d5e",
      "statusAfter": null
    }
  ]
}
